{
  "data_sources": {
    "seats": "analysis/seats/2027nsw.txt"
  },
  "election_code": "2027nsw",
  "election_name": "2027 NSW State Election",
  "election_settings": {
    "federal_election_date": "2028-05-22",
    "previous_election_tpp": 54.2599983215332,
    "previous_term_codes": [
      "2023nsw",
      "2019nsw"
    ]
  },
  "files": {
    "nonclassic_preferences": "nonclassic-preferences.csv",
    "parties": "parties.csv",
    "party_official_codes": "party-official-codes.csv",
    "regions": "regions.csv"
  },
  "id": "forecast-2027nsw",
  "models": [
    {
      "id": "standard-model",
      "name": "Standard Model",
      "parties": [
        {
          "code": "ALP",
          "preference_deviation": 0.0,
          "preference_samples": 0.0
        },
        {
          "code": "LNP",
          "preference_deviation": 0.0,
          "preference_samples": 0.0
        },
        {
          "code": "GRN",
          "preference_deviation": 3.7300000190734863,
          "preference_samples": 7.0
        },
        {
          "code": "ONP",
          "preference_deviation": 15.0,
          "preference_samples": 7.0
        },
        {
          "code": "OTH",
          "preference_deviation": 5.210000038146973,
          "preference_samples": 7.0
        },
        {
          "code": "xOTH",
          "preference_deviation": 5.210000038146973,
          "preference_samples": 7.0
        },
        {
          "code": "eOTH",
          "preference_deviation": 5.210000038146973,
          "preference_samples": 7.0
        }
      ],
      "term_code": "2027nsw"
    }
  ],
  "party_settings": {
    "major_party_one_id": "labor",
    "major_party_two_id": "liberal-national-coalition"
  },
  "projections": [
    {
      "base_model_id": "standard-model",
      "end_date": "2027-03-12",
      "id": "projection-2027-election-projection",
      "name": "2027 Election Projection",
      "num_iterations": 3000,
      "possible_dates": []
    }
  ],
  "schema_version": 1,
  "simulations": [
    {
      "base_projection_id": "projection-2027-election-projection",
      "id": "standard-simulation",
      "mode": "projection",
      "name": "Standard Simulation",
      "num_iterations": 250000,
      "report_mode": "regular_forecast"
    },
    {
      "base_projection_id": "projection-2027-election-projection",
      "id": "now-cast-simulation",
      "mode": "projection",
      "name": "Now-cast Simulation",
      "num_iterations": 250000,
      "report_mode": "nowcast"
    },
    {
      "base_projection_id": "projection-2027-election-projection",
      "id": "live-simulation",
      "mode": "live_manual",
      "name": "Live Simulation",
      "num_iterations": 20000,
      "report_mode": "regular_forecast"
    }
  ]
}
