{
  "data_sources": {
    "seats": "analysis/seats/2025wa.txt"
  },
  "election_code": "2025wa",
  "election_name": "2025 WA State Election",
  "election_settings": {
    "federal_election_date": "2025-05-17",
    "live_sources": {
      "current_real_url": "forecasts/2025wa/live-snapshots/feeds",
      "current_test_url": "",
      "preload_url": "",
      "previous_results_url": ""
    },
    "previous_election_tpp": 69.68000030517578,
    "previous_term_codes": [
      "2021wa"
    ]
  },
  "files": {
    "nonclassic_preferences": "nonclassic-preferences.csv",
    "parties": "parties.csv",
    "party_official_codes": "party-official-codes.csv",
    "regions": "regions.csv"
  },
  "id": "forecast-2025wa",
  "models": [
    {
      "id": "standard-model",
      "name": "Standard Model",
      "parties": [
        {
          "code": "ALP",
          "preference_deviation": 0.0,
          "preference_samples": 0.0
        },
        {
          "code": "LIB",
          "preference_deviation": 0.0,
          "preference_samples": 0.0
        },
        {
          "code": "NAT",
          "preference_deviation": 0.0,
          "preference_samples": 0.0
        },
        {
          "code": "GRN",
          "preference_deviation": 3.7300000190734863,
          "preference_samples": 7.0
        },
        {
          "code": "OTH",
          "preference_deviation": 5.210000038146973,
          "preference_samples": 7.0
        },
        {
          "code": "xOTH",
          "preference_deviation": 5.210000038146973,
          "preference_samples": 7.0
        },
        {
          "code": "eOTH",
          "preference_deviation": 8.0600004196167,
          "preference_samples": 18.0
        }
      ],
      "term_code": "2025wa"
    }
  ],
  "party_settings": {
    "major_party_one_id": "labor",
    "major_party_two_id": "liberals"
  },
  "projections": [
    {
      "base_model_id": "standard-model",
      "end_date": "2025-03-07",
      "id": "standard-projection",
      "name": "Standard Projection",
      "num_iterations": 10000,
      "possible_dates": []
    },
    {
      "base_model_id": "standard-model",
      "end_date": "2025-03-08",
      "id": "now-cast",
      "name": "Now-cast",
      "num_iterations": 300,
      "possible_dates": []
    }
  ],
  "schema_version": 1,
  "simulations": [
    {
      "base_projection_id": "standard-projection",
      "id": "standard-simulation",
      "mode": "projection",
      "name": "Standard Simulation",
      "num_iterations": 250000,
      "report_mode": "regular_forecast"
    },
    {
      "base_projection_id": "now-cast",
      "id": "now-cast-simulation",
      "mode": "projection",
      "name": "Now-cast Simulation",
      "num_iterations": 250000,
      "report_mode": "nowcast"
    },
    {
      "base_projection_id": "standard-projection",
      "id": "live-simulation",
      "mode": "live_automatic",
      "name": "Live Simulation",
      "num_iterations": 10000,
      "report_mode": "live_forecast"
    }
  ]
}
