{
  "data_sources": {
    "seats": "analysis/seats/2019fed.txt"
  },
  "election_code": "2019fed",
  "election_name": "2019 Federal Election",
  "election_settings": {
    "federal_election_date": "2019-05-18",
    "live_sources": {
      "current_real_url": "local:fed2019-replay.xml",
      "current_test_url": "",
      "preload_url": "local:downloads/2019fed-preload.xml",
      "previous_results_url": "ftp://mediafeedarchive.aec.gov.au/20499/Detailed/Verbose/aec-mediafeed-Detailed-Verbose-20499-20170511174118.zip"
    },
    "previous_election_tpp": 49.630001068115234,
    "previous_term_codes": [
      "2016fed",
      "2013fed"
    ]
  },
  "files": {
    "nonclassic_preferences": "nonclassic-preferences.csv",
    "parties": "parties.csv",
    "party_official_codes": "party-official-codes.csv",
    "regions": "regions.csv"
  },
  "id": "forecast-2019fed",
  "models": [
    {
      "id": "standard-model",
      "name": "Standard Model",
      "parties": [
        {
          "code": "ALP",
          "preference_deviation": 0.0,
          "preference_samples": 0.0
        },
        {
          "code": "LNP",
          "preference_deviation": 0.0,
          "preference_samples": 0.0
        },
        {
          "code": "GRN",
          "preference_deviation": 3.7300000190734863,
          "preference_samples": 7.0
        },
        {
          "code": "ONP",
          "preference_deviation": 7.769999980926514,
          "preference_samples": 18.0
        },
        {
          "code": "UAP",
          "preference_deviation": 7.769999980926514,
          "preference_samples": 18.0
        },
        {
          "code": "OTH",
          "preference_deviation": 5.210000038146973,
          "preference_samples": 7.0
        },
        {
          "code": "xOTH",
          "preference_deviation": 5.210000038146973,
          "preference_samples": 7.0
        },
        {
          "code": "eOTH",
          "preference_deviation": 5.210000038146973,
          "preference_samples": 7.0
        }
      ],
      "term_code": "2019fed"
    }
  ],
  "party_settings": {
    "major_party_one_id": "labor",
    "major_party_two_id": "liberals"
  },
  "projections": [
    {
      "base_model_id": "standard-model",
      "end_date": "2019-05-18",
      "id": "projection-2019-election-projection",
      "name": "2019 Election Projection",
      "num_iterations": 200000,
      "possible_dates": []
    },
    {
      "base_model_id": "standard-model",
      "end_date": "2019-05-17",
      "id": "now-cast-projection",
      "name": "Now-cast Projection",
      "num_iterations": 10000,
      "possible_dates": []
    }
  ],
  "schema_version": 1,
  "simulations": [
    {
      "base_projection_id": "projection-2019-election-projection",
      "id": "standard-simulation",
      "mode": "projection",
      "name": "Standard Simulation",
      "num_iterations": 200000,
      "report_mode": "regular_forecast"
    },
    {
      "base_projection_id": "projection-2019-election-projection",
      "id": "nowcast-simulation",
      "mode": "projection",
      "name": "Nowcast Simulation",
      "num_iterations": 10000,
      "report_mode": "nowcast"
    },
    {
      "base_projection_id": "projection-2019-election-projection",
      "id": "live-simulation",
      "mode": "live_automatic",
      "name": "Live Simulation",
      "num_iterations": 10000,
      "report_mode": "live_forecast"
    }
  ]
}
