{
  "data_sources": {
    "seats": "analysis/seats/2024qld.txt"
  },
  "election_code": "2024qld",
  "election_name": "2024 Queensland State Election",
  "election_settings": {
    "federal_election_date": "2025-05-22",
    "previous_election_tpp": 53.20000076293945,
    "previous_term_codes": [
      "2020qld"
    ]
  },
  "files": {
    "nonclassic_preferences": "nonclassic-preferences.csv",
    "parties": "parties.csv",
    "party_official_codes": "party-official-codes.csv",
    "regions": "regions.csv"
  },
  "id": "forecast-2024qld",
  "models": [
    {
      "id": "standard-model",
      "name": "Standard Model",
      "parties": [
        {
          "code": "ALP",
          "preference_deviation": 0.0,
          "preference_samples": 0.0
        },
        {
          "code": "LNP",
          "preference_deviation": 0.0,
          "preference_samples": 0.0
        },
        {
          "code": "GRN",
          "preference_deviation": 3.490000009536743,
          "preference_samples": 8.0
        },
        {
          "code": "ONP",
          "preference_deviation": 7.771999835968018,
          "preference_samples": 27.0
        },
        {
          "code": "OTH",
          "preference_deviation": 4.8979997634887695,
          "preference_samples": 8.0
        },
        {
          "code": "xOTH",
          "preference_deviation": 4.8979997634887695,
          "preference_samples": 8.0
        },
        {
          "code": "eOTH",
          "preference_deviation": 4.8979997634887695,
          "preference_samples": 8.0
        }
      ],
      "term_code": "2024qld"
    }
  ],
  "party_settings": {
    "major_party_one_id": "labor",
    "major_party_two_id": "liberal-national-party"
  },
  "projections": [
    {
      "base_model_id": "standard-model",
      "end_date": "2024-10-25",
      "id": "standard-projection",
      "name": "Standard Projection",
      "num_iterations": 2000,
      "possible_dates": []
    },
    {
      "base_model_id": "standard-model",
      "end_date": "2024-10-25",
      "id": "now-cast",
      "name": "Now-cast",
      "num_iterations": 2000,
      "possible_dates": []
    }
  ],
  "schema_version": 1,
  "simulations": [
    {
      "base_projection_id": "standard-projection",
      "id": "standard-simulation",
      "mode": "projection",
      "name": "Standard Simulation",
      "num_iterations": 10000,
      "report_mode": "regular_forecast"
    },
    {
      "base_projection_id": "now-cast",
      "id": "nowcast-simulation",
      "mode": "projection",
      "name": "Nowcast Simulation",
      "num_iterations": 10000,
      "report_mode": "nowcast"
    },
    {
      "base_projection_id": "standard-projection",
      "id": "live-simulation",
      "mode": "live_automatic",
      "name": "Live Simulation",
      "num_iterations": 10000,
      "report_mode": "live_forecast"
    }
  ]
}
